,published_At,updated_At,author_DisplayName,text_Original,text_Display,viewer_Rating,like_Count,author_Channel_Id
58,2023-09-29T04:11:57Z,2023-09-29T04:11:57Z,Larry Lyon,Bet would this technology really improves on line counseling with a therapist or AI.,Bet would this technology really improves on line counseling with a therapist or AI.,none,0,UCs2ygsw-CfEogwvH8zjscIQ
59,2023-09-29T04:11:51Z,2023-09-29T04:11:51Z,Efrain Rodriguez,We are all going to die 😢,We are all going to die 😢,none,0,UCe3OHRN1a2EJaHhV_E-Bjuw
60,2023-09-29T04:11:40Z,2023-09-29T04:11:40Z,Traveller,this is so uncomfortable to watch. Uncanny valley.,this is so uncomfortable to watch. Uncanny valley.,none,0,UCVRLuG7aysWeFDSv4tR5Yzg
61,2023-09-29T04:11:32Z,2023-09-29T04:11:32Z,Marie Alsbergas,Smells also carry a lot of information about the well being of your conversational partner. This is missing. How can this technology be adapted for gestures and sign languages?,Smells also carry a lot of information about the well being of your conversational partner. This is missing. How can this technology be adapted for gestures and sign languages?,none,0,UC2IGL3oekAZj_GYp826fneQ
62,2023-09-29T04:11:24Z,2023-09-29T04:11:24Z,Joydeep Mohanto,wow! Mark's work is amazing.,wow! Mark&#39;s work is amazing.,none,2,UCvnJvleebSE1HIyeUvbC7Dg
63,2023-09-29T04:11:07Z,2023-09-29T04:11:07Z,Sean Hyde,Silent revolution of truth. Creational truth. Future of mankind. BEAM . The spreading of the correct peace symbol. Goblet of truth. Look into it,Silent revolution of truth. Creational truth. Future of mankind. BEAM . The spreading of the correct peace symbol. Goblet of truth. Look into it,none,0,UCroDXfDd12hKCLjfNUeMbfA
64,2023-09-29T04:10:39Z,2023-09-29T04:10:39Z,Jeff Gadbois,Can't wait to have this💯🤝,Can&#39;t wait to have this💯🤝,none,0,UCDvF5F3AGaXgHr7EZ94Td6A
65,2023-09-29T04:10:28Z,2023-09-29T04:10:28Z,Kain A,What a shill,What a shill,none,1,UCGoGlRPt-z6xgeaLl7TgOxA
66,2023-09-29T04:10:07Z,2023-09-29T04:10:07Z,Larry Lyon,Curious whether improvements to mobile screens are possible to display 2D+ graphics.  Really wild guys!,Curious whether improvements to mobile screens are possible to display 2D+ graphics.  Really wild guys!,none,0,UCs2ygsw-CfEogwvH8zjscIQ
67,2023-09-29T04:09:51Z,2023-09-29T04:09:51Z,Jim Johnson,Why does Lex keep mentioning emotions? Like who's he trying to convince? He doesn't have emotions.,Why does Lex keep mentioning emotions? Like who&#39;s he trying to convince? He doesn&#39;t have emotions.,none,0,UCdLxQUf5af7tclbmNqzJf2A
68,2023-09-29T04:09:18Z,2023-09-29T04:09:18Z,Tom Peary,Only reason he built it was to finally look more human and less of a cyborg.,Only reason he built it was to finally look more human and less of a cyborg.,none,0,UCTFE-dqLE9TI9PnXDkkBiAw
69,2023-09-29T04:08:35Z,2023-09-29T04:08:35Z,En1gmatic1,Is this running on Quest Pro natively on stand-alone!?!?,Is this running on Quest Pro natively on stand-alone!?!?,none,0,UCySxAVFLm7AIL3EPaHomsSw
70,2023-09-29T04:08:18Z,2023-09-29T04:08:18Z,A B,"And this, ladies and gentlemen, is why home and car prices have tripled in price. You’ll be like Neo from the matrix sleeping in a tiny virtual pod. No need for a backyard or driving to get groceries.","And this, ladies and gentlemen, is why home and car prices have tripled in price. You’ll be like Neo from the matrix sleeping in a tiny virtual pod. No need for a backyard or driving to get groceries.",none,0,UC3WbE2uyupuhPZxLnVonszw
71,2023-09-29T04:06:53Z,2023-09-29T04:06:53Z,A K,wow,wow,none,0,UCg09sia0xdpbHo00o4d56pw
72,2023-09-29T04:06:09Z,2023-09-29T04:06:09Z,WesterLund,This is fascinating! Lex's podcast is really full of landmark episodes,This is fascinating! Lex&#39;s podcast is really full of landmark episodes,none,148,UChhxM2JN5N0JhuIrhQL6wDg
73,2023-09-29T04:05:54Z,2023-09-29T04:05:54Z,Keith Price,I do not want this. What a horrible way to communicate. Why take a real human and turn them into something virtual? It's like we're trying to destroy everything meaningful about human contact.,I do not want this. What a horrible way to communicate. Why take a real human and turn them into something virtual? It&#39;s like we&#39;re trying to destroy everything meaningful about human contact.,none,1,UCNhGWy7aoljoy9D4VL7nc1A
74,2023-09-29T04:05:37Z,2023-09-29T04:05:37Z,Braunson Rogers,This is actually amazing,This is actually amazing,none,0,UC8FUdJo8M4ce8tGF4WTVTXw
75,2023-09-29T04:05:18Z,2023-09-29T04:05:18Z,StevieMeeks,Some moments when I hyper focus on his face I get some minor uncanny valley. But other times Id completely forget they are not physical videos,Some moments when I hyper focus on his face I get some minor uncanny valley. But other times Id completely forget they are not physical videos,none,0,UCb5iDYsKVr3sRwd4sAqIhvQ
76,2023-09-29T04:05:10Z,2023-09-29T04:05:10Z,meclonal,Incredible,Incredible,none,0,UC9Kpvq6nAdgnt4b41BURyag
77,2023-09-29T04:05:04Z,2023-09-29T04:05:04Z,Mahendra Shitole,❤,❤,none,0,UC4t7AOVAFoGrb4N5AVx6uDg
78,2023-09-29T04:04:15Z,2023-09-29T04:04:15Z,Roberto Rodriguez Munoz,"I don’t know what is weirder. Lex and Mark talking in the metaverse, or Lex without a suit.","I don’t know what is weirder. Lex and Mark talking in the metaverse, or Lex without a suit.",none,20,UCQCwWcQ-Sheu_uM3KzuyCQw
79,2023-09-29T04:04:09Z,2023-09-29T04:04:09Z,Nuriddin Burkhonov,"Thanks Lex, thanks Mark!","Thanks Lex, thanks Mark!",none,0,UCGiEBZZ9jIQkOUvNRvVrRww
80,2023-09-29T04:04:08Z,2023-09-29T04:37:29Z,dotails,"Be honest Mark, have you been ""calling in"" connect appearance using this tech?","Be honest Mark, have you been &quot;calling in&quot; connect appearance using this tech?",none,0,UClgnRGY7H1eHrzCydkXetZg
81,2023-09-29T04:02:47Z,2023-09-29T04:02:47Z,REDA QQ,This video going to be the best video in 2023 😮,This video going to be the best video in 2023 😮,none,1,UCbXhCrlUWMcVn-jN8ZeQJHA
82,2023-09-29T04:01:52Z,2023-09-29T04:01:52Z,LOU GEE,Its crazy how quickly you can forget that those arent really them lol inceedible😊,Its crazy how quickly you can forget that those arent really them lol inceedible😊,none,0,UCgG_D4Dy66jntB7VKFEX-og
83,2023-09-29T04:01:33Z,2023-09-29T04:01:33Z,Jared Rowe,"This is absolutely mind blowing. Please tell me that this audio is from the oculus, I know it is likely a shotgun mic, bu my god if that is the audio from the oculus pro then my mind is blown and that needs more love here also.","This is absolutely mind blowing. Please tell me that this audio is from the oculus, I know it is likely a shotgun mic, bu my god if that is the audio from the oculus pro then my mind is blown and that needs more love here also.",none,0,UC3T2GdVU1aGgl_kjbFOvezg
84,2023-09-29T04:00:55Z,2023-09-29T04:00:55Z,Sam,God save us ✝️,God save us ✝️,none,0,UCn8w3Htme-2wAPMi72I7wzQ
85,2023-09-29T04:00:51Z,2023-09-29T04:00:51Z,4the1time,"@28:00 This was very interesting. I’m wondering how open Mark is to having these experiments be recorded and open to the public for feedback. As it is, the engineers (and finance/mgmt😂) determine what is appropriate to release. What if we (Meta) truly used an iterative process with public opinion involved. I believe this is an interesting topic that I should be appreciated. Thank you!","@<a href=""https://www.youtube.com/watch?v=MVYrJJNdrEg&amp;t=28m00s"">28:00</a> This was very interesting. I’m wondering how open Mark is to having these experiments be recorded and open to the public for feedback. As it is, the engineers (and finance/mgmt😂) determine what is appropriate to release. What if we (Meta) truly used an iterative process with public opinion involved. I believe this is an interesting topic that I should be appreciated. Thank you!",none,0,UCA3oIFa0ezdVrdP32otgOxg
86,2023-09-29T04:00:09Z,2023-09-29T04:00:09Z,BB8 Luke,Please come back to the matrix.. it's more fun here,Please come back to the matrix.. it&#39;s more fun here,none,0,UCj9aV5nn7aVb5Tpc6tmYlJg
87,2023-09-29T03:59:25Z,2023-09-29T03:59:25Z,RaziEL3CTRIC,Holy moly!,Holy moly!,none,0,UCBH0ZyDqDB5Wo6mmmldedbQ
88,2023-09-29T03:58:56Z,2023-09-29T03:58:56Z,James Sanchez,Two reptilians in their natural form crazy,Two reptilians in their natural form crazy,none,0,UCdj9HSSQFZNG7urj_rLt9_A
89,2023-09-29T03:58:48Z,2023-09-29T03:58:48Z,JEKM,There couldn’t have been 2 better guys to demo this tech.  Lex and Mark are super inexpressive facially.,There couldn’t have been 2 better guys to demo this tech.  Lex and Mark are super inexpressive facially.,none,0,UCiRZG7fL4rYIw1ccvnhdpKQ
90,2023-09-29T03:58:36Z,2023-09-29T03:58:36Z,J.Hardesty,It's a new dimension,It&#39;s a new dimension,none,0,UC09dAa57QWRuIb8drPXLvMA
91,2023-09-29T03:58:19Z,2023-09-29T03:58:19Z,Ken C,I think it’s cool to watch this! Give us some scenery !,I think it’s cool to watch this! Give us some scenery !,none,0,UCbLLdm-WCvpgoIQRFFIAcKQ
92,2023-09-29T03:58:08Z,2023-09-29T03:58:08Z,Tyrant Tommy,Is there a VR version of this podcast we can watch on a headset? That seems like it would be cool.,Is there a VR version of this podcast we can watch on a headset? That seems like it would be cool.,none,0,UCydxoynOVsFT4EWcgC7Y_Bw
93,2023-09-29T03:58:07Z,2023-09-29T03:58:07Z,Proud mOnkey,"I guess we finally cross the point of no return.. Welcome to the future, my digital friends. 😏","I guess we finally cross the point of no return.. Welcome to the future, my digital friends. 😏",none,0,UCZp88D-_97fOKN7Rsc6hQlQ
94,2023-09-29T03:57:56Z,2023-09-29T03:57:56Z,NzThings,Lex Zuck is corrupt and against democracy,Lex Zuck is corrupt and against democracy,none,0,UCx1ilLdUD7fieGxHybIpZBw
95,2023-09-29T03:57:41Z,2023-09-29T03:57:41Z,royaldust,no tie,no tie,none,0,UCGLsif50oGf0dTC6B3H6BTQ
96,2023-09-29T03:57:22Z,2023-09-29T03:57:22Z,G M,"It looked so incredible 

I showed my wife and she was like “that looks like a video game” 

She’s just not impressed because she doesn’t know how hard it is to do what is happening.",It looked so incredible <br><br>I showed my wife and she was like “that looks like a video game” <br><br>She’s just not impressed because she doesn’t know how hard it is to do what is happening.,none,0,UCL1IhmIWddYCqR1Z_SAUvSg
97,2023-09-29T03:57:13Z,2023-09-29T03:57:13Z,Adam Bednarczyk,lex will surpass rogan for biggest podcast in the world. technology is at the forefront of the world and lex has his finger on the pulse of it.,lex will surpass rogan for biggest podcast in the world. technology is at the forefront of the world and lex has his finger on the pulse of it.,none,1,UCxHG7oWnTrYafnqucDN8E0A
98,2023-09-29T03:56:51Z,2023-09-29T03:56:51Z,Steve,Very cool,Very cool,none,0,UC6TZph0eSetOD9Nmb2NJplA
99,2023-09-29T03:55:50Z,2023-09-29T03:55:50Z,johnyaxon,It looks like both of you stuck in black liquid,It looks like both of you stuck in black liquid,none,1,UCeqyGpk8exyi27oVU9dcccw
