,published_At,updated_At,author_DisplayName,text_Original,text_Display,viewer_Rating,like_Count,author_Channel_Id
0,2023-09-29T15:49:20Z,2023-09-29T15:49:20Z,Cyborg 1612,It’s giving Death Stranding,It’s giving Death Stranding,none,0,UCDE30H4UkYK400UNiDaZFow
1,2023-09-29T15:47:10Z,2023-09-29T15:47:10Z,BLSTC blender ,nice try lex but we all know Mark Zuckerberg isn't real,nice try lex but we all know Mark Zuckerberg isn&#39;t real,none,0,UCxItz3Gu75RFRU446qQS3WA
2,2023-09-29T15:45:56Z,2023-09-29T15:45:56Z,Colin McIntosh,Black Mirror script writers watching this and furiously scribbling notes,Black Mirror script writers watching this and furiously scribbling notes,none,0,UCoXFkVqGMA62g5NEjRyQkMQ
3,2023-09-29T15:44:13Z,2023-09-29T15:44:13Z,Michael D. Anderson,"Two observations:
1. Lex probably isn't wearing his iconic suit becuase it would be hard to distinguish him from the black environment (he would look like a floating head.) Alternatively, it's because when he got the scan done, this was the outfit he was in and they wanted consistency between the avatar and Lex.
2. Lex's avatar seems to be a higher quality (lighting, details, pixel density) than Mark's avatar. My guess is this is because Mark had his avatar done months before Lex, back with the tech was earlier in development. 

Just my $.02, I'm curious what other people think.","Two observations:<br>1. Lex probably isn&#39;t wearing his iconic suit becuase it would be hard to distinguish him from the black environment (he would look like a floating head.) Alternatively, it&#39;s because when he got the scan done, this was the outfit he was in and they wanted consistency between the avatar and Lex.<br>2. Lex&#39;s avatar seems to be a higher quality (lighting, details, pixel density) than Mark&#39;s avatar. My guess is this is because Mark had his avatar done months before Lex, back with the tech was earlier in development. <br><br>Just my $.02, I&#39;m curious what other people think.",none,1,UC-lzRdnOByYmxZ4svtR2TIA
4,2023-09-29T15:43:59Z,2023-09-29T15:43:59Z,TheIronpusher,"That's really cool Mark! The innovation looks amazing! Now can you please leave Whatsapp alone? We don't want another social media platform of likes and following people. It always been a messenger for your personal contacts, let's keep it that way.","That&#39;s really cool Mark! The innovation looks amazing! Now can you please leave Whatsapp alone? We don&#39;t want another social media platform of likes and following people. It always been a messenger for your personal contacts, let&#39;s keep it that way.",none,0,UC-lWYv9_SkgOpwfzPFtj5cw
5,2023-09-29T15:42:54Z,2023-09-29T15:42:54Z,Tobi L,I love how Mark understands people think his expression is monotone,I love how Mark understands people think his expression is monotone,none,7,UCcTCStBl-83fq1sQRXHyzog
6,2023-09-29T15:41:48Z,2023-09-29T15:41:48Z,Fazendo jogo!,"Can you put some background, please? I don't like to be in complete emptiness. 😎","Can you put some background, please? I don&#39;t like to be in complete emptiness. 😎",none,0,UCzTwKpnbgkSo0XtNba6RAMw
7,2023-09-29T15:41:03Z,2023-09-29T15:41:03Z,Hot Tub Too Hot,"You know everyone is guna go for fake avatars. Big titty goth chicks, anime,  furries, dudes extremely muscular who are actually obese.","You know everyone is guna go for fake avatars. Big titty goth chicks, anime,  furries, dudes extremely muscular who are actually obese.",none,0,UCxRSGuUTQmqVXe7bSMu5UcA
8,2023-09-29T15:39:58Z,2023-09-29T15:39:58Z,TheBig Pedro,"One small step for shareholders, one giant leap towards dystopia.","One small step for shareholders, one giant leap towards dystopia.",none,4,UCdqVLvMhVki3dWoUVHSc5Ng
9,2023-09-29T15:39:57Z,2023-09-29T15:40:19Z,Kumodot,"That's amazing. What a experience to been able to test that. 
I was wondering why you (Lex) close your eyes for a long time while talking. Is this you or the system just loosing track of something and activating the closed eyes blend shape ?",That&#39;s amazing. What a experience to been able to test that. <br>I was wondering why you (Lex) close your eyes for a long time while talking. Is this you or the system just loosing track of something and activating the closed eyes blend shape ?,none,0,UCK5X484YKJPf-ohMSZ8UuNg
10,2023-09-29T15:39:37Z,2023-09-29T15:39:37Z,Dubai Shorts,So what if someone hacks you and use your likenes?...,So what if someone hacks you and use your likenes?...,none,0,UCdJoBL8gZQkRaHQW5IF9eyg
11,2023-09-29T15:38:40Z,2023-09-29T15:38:40Z,Hunter Kowald,Long ad,Long ad,none,2,UCYNDtecCHHP6sdKWHAbEd3w
12,2023-09-29T15:37:28Z,2023-09-29T15:37:28Z,tagberli,"Now AI learned how to create realistic virtual realities, Matrix will soon become a historical documentary","Now AI learned how to create realistic virtual realities, Matrix will soon become a historical documentary",none,0,UCdYXUZGWZvZBdZ2KvtEijww
13,2023-09-29T15:37:21Z,2023-09-29T15:37:21Z,RezaS,"Very impressive!! But as Mark said it is more immersive for the two of you not for the people who watch you. 
imho, after watching 15 min of video it gets very boring to just watch faces in a dark background and I would prefer to see the actual person or at least their hands as well. Because hands and body gestures are also part of the expression","Very impressive!! But as Mark said it is more immersive for the two of you not for the people who watch you. <br>imho, after watching 15 min of video it gets very boring to just watch faces in a dark background and I would prefer to see the actual person or at least their hands as well. Because hands and body gestures are also part of the expression",none,0,UCWOn7IKF3lBnvtATdMOS3Lg
14,2023-09-29T15:36:13Z,2023-09-29T15:36:13Z,Cladeus,"Alright zuckerbot, not bad at all.","Alright zuckerbot, not bad at all.",none,0,UCGHjgk3NsTdl4NGZD4LTYcg
15,2023-09-29T15:35:48Z,2023-09-29T15:35:48Z,tagberli,"Now AI learned how to create realistic virtual realities, we are doomed","Now AI learned how to create realistic virtual realities, we are doomed",none,0,UCdYXUZGWZvZBdZ2KvtEijww
16,2023-09-29T15:35:30Z,2023-09-29T15:52:10Z,Spamkromite,"So instead of spending in cheap cameras for meetups, you just render yourself as accurately as possible for... the same effect but more expensive and more CARBON PRINT ridden. Bravo 👏
You are still 5 years late to the party with this tech.","So instead of spending in cheap cameras for meetups, you just render yourself as accurately as possible for... the same effect but more expensive and more CARBON PRINT ridden. Bravo 👏<br>You are still 5 years late to the party with this tech.",none,1,UCFD_VTSpY91jq0ngaq8d4rQ
17,2023-09-29T15:34:53Z,2023-09-29T15:34:53Z,susy may,"Please keep making fabulous timestamps!!!
❤❤❤❤❤",Please keep making fabulous timestamps!!!<br>❤❤❤❤❤,none,1,UCHsSnshNppfo38lauFQQV2A
18,2023-09-29T15:34:49Z,2023-09-29T15:34:49Z,bussychungus,"This is literally the series ""upload"". Wtf this is fu'''ing crazyyyy",This is literally the series &quot;upload&quot;. Wtf this is fu&#39;&#39;&#39;ing crazyyyy,none,0,UC9fX-Xy2mdbCD1H-ep33OhQ
19,2023-09-29T15:34:18Z,2023-09-29T15:34:18Z,J N,On that note... I'm out. ✌️,On that note... I&#39;m out. ✌️,none,0,UC1vwuFcL9VjF-oLx7sh1onw
20,2023-09-29T15:34:00Z,2023-09-29T15:34:20Z,Erdos Renyi,i find it really interesting they seem to have passed the uncanny valley threshold.,i find it really interesting they seem to have passed the uncanny valley threshold.,none,1,UCwepdbsy-dOYcvbKqFfdEpQ
21,2023-09-29T15:33:44Z,2023-09-29T15:33:44Z,Alex Caminiti,"Really impressive. Unfortunately, however, you will no doubt need a FB account. One of the worst things anyone could have if they give one iota about their privacy, or for that matter - without hyperbole - the future of humanity.","Really impressive. Unfortunately, however, you will no doubt need a FB account. One of the worst things anyone could have if they give one iota about their privacy, or for that matter - without hyperbole - the future of humanity.",none,0,UCxAEIvj4nuCpSSAr50t9u6g
22,2023-09-29T15:33:18Z,2023-09-29T15:33:18Z,zAllex Music,"Now develop software able to analyze and create an exact duplicate of someone's consciousness , then blend these two techs together. ;)","Now develop software able to analyze and create an exact duplicate of someone&#39;s consciousness , then blend these two techs together. ;)",none,0,UCnoHolRzRoyA6rvWjWMSWNQ
23,2023-09-29T15:31:14Z,2023-09-29T15:31:14Z,cag03hd,"""get more people into the system"".  One step closer to the Matrix.  No thanks.",&quot;get more people into the system&quot;.  One step closer to the Matrix.  No thanks.,none,0,UCEJ0SGPDsYnlQUYpOn9K13Q
24,2023-09-29T15:30:55Z,2023-09-29T15:30:55Z,DanTheMan,Its now 31 years since Lawnmower Man was in the cinemas... Turns out VR is a thing after all...,Its now 31 years since Lawnmower Man was in the cinemas... Turns out VR is a thing after all...,none,0,UCzj7J--T6HEJrNWJijPetAw
25,2023-09-29T15:30:14Z,2023-09-29T15:30:14Z,Nan0Scho1ar,I think that a crossover between VR and livestreaming would be quite interesting,I think that a crossover between VR and livestreaming would be quite interesting,none,0,UC0aGTI4pZOoeL-cYvwJb_rQ
26,2023-09-29T15:30:13Z,2023-09-29T15:30:13Z,tagberli,It was genius of Mark to get the most emotionless podcast host to reveal this technology 😂,It was genius of Mark to get the most emotionless podcast host to reveal this technology 😂,none,0,UCdYXUZGWZvZBdZ2KvtEijww
27,2023-09-29T15:28:26Z,2023-09-29T15:28:26Z,Shoppster,Whoa. Just... Whoa.,Whoa. Just... Whoa.,none,0,UC_yf_OfVt_Vu-n-YDbeU1Uw
28,2023-09-29T15:28:07Z,2023-09-29T15:28:07Z,Joyleen Camielle Greene,Kodak photo realistic Face Lifts... next big career :),Kodak photo realistic Face Lifts... next big career :),none,0,UCu3SUdbUxAP291MijJ191rQ
29,2023-09-29T15:28:01Z,2023-09-29T15:28:01Z,Alexander Allegra,"Terrifying, no human quality, losing sense of reality, this guy is a reptile","Terrifying, no human quality, losing sense of reality, this guy is a reptile",none,0,UCWofCAOh1FHhRddPQnLRzEA
30,2023-09-29T15:27:10Z,2023-09-29T15:27:10Z,Slick Diecast,I can’t wait to play Ready Player One!,I can’t wait to play Ready Player One!,none,0,UCo-SQKMzwQUCc8cf0a_al6w
31,2023-09-29T15:26:02Z,2023-09-29T15:26:02Z,Tim Stewart,"Next level, when AI gets to the point it can accurately imitate someone’s personality this is going to get insane…","Next level, when AI gets to the point it can accurately imitate someone’s personality this is going to get insane…",none,0,UC8w5lfvF4QiqjYqZeTMueng
32,2023-09-29T15:25:07Z,2023-09-29T15:25:07Z,misnomer,Codec Avatar has just sold Lex’s likeness to CamBridge ANALytica,Codec Avatar has just sold Lex’s likeness to CamBridge ANALytica,none,0,UC5XqUEUlk4CgyB0D19tSLNA
33,2023-09-29T15:23:06Z,2023-09-29T15:23:06Z,Patlegolfeur P,"The previous versions of the Metaverse from Meta were kinda lame but this is actually impressive. It just needs a bit more to get over that ""uncanny valley"" but it's so close!",The previous versions of the Metaverse from Meta were kinda lame but this is actually impressive. It just needs a bit more to get over that &quot;uncanny valley&quot; but it&#39;s so close!,none,0,UCb3ZrgsT_oW0gdKkQ1Al7HA
34,2023-09-29T15:22:58Z,2023-09-29T15:22:58Z,Wes,This is incredible,This is incredible,none,0,UC_yMJ8ISAc6JYEWQEDbqcKQ
35,2023-09-29T15:22:46Z,2023-09-29T15:22:46Z,HopeForPeave,Well this is oddly terrifying.,Well this is oddly terrifying.,none,0,UCLGfwT9mW1zfpvRfjpiyrjQ
36,2023-09-29T15:22:35Z,2023-09-29T15:22:35Z,WakeRunSleep,Could have asked a single question about privacy issues,Could have asked a single question about privacy issues,none,0,UCegRUQOcPGJ8QqLFk5E3N0Q
37,2023-09-29T15:22:27Z,2023-09-29T15:22:27Z,matt woods,As soon as I took off the quest pro for the first time... The first thing I did was buy a bag of META stock. That proved to be a very lucrative move. Still long on this company despite the dubious history with Facebook. Mark has demonstrated that he is clearly still running the company as a startup and a founder. This will set them apart in the long run.,As soon as I took off the quest pro for the first time... The first thing I did was buy a bag of META stock. That proved to be a very lucrative move. Still long on this company despite the dubious history with Facebook. Mark has demonstrated that he is clearly still running the company as a startup and a founder. This will set them apart in the long run.,none,0,UCQdKRN4A1JRalwWqNnRk9eg
38,2023-09-29T15:21:52Z,2023-09-29T15:21:52Z,Cre8,The future of how humans will “connect” in “deeply meaningful” ways. Humanity is doomed.,The future of how humans will “connect” in “deeply meaningful” ways. Humanity is doomed.,none,0,UC6JL_3kgeeBaaMdIrHxnRfQ
39,2023-09-29T15:20:02Z,2023-09-29T15:20:02Z,R C,"Holy crap, this is just awful!","Holy crap, this is just awful!",none,0,UCG-hOxzJRe7GwOikvZzyWzg
40,2023-09-29T15:19:46Z,2023-09-29T15:19:46Z,JM,This is truly astonishing tech. But also a huge security problem that could take deep fakes to the next level. Imagine if Meta in the future has millions of these h photo-realistic scans on file and they inevitably get hacked and all of it gets stolen and sold to the highest bidder.,This is truly astonishing tech. But also a huge security problem that could take deep fakes to the next level. Imagine if Meta in the future has millions of these h photo-realistic scans on file and they inevitably get hacked and all of it gets stolen and sold to the highest bidder.,none,0,UCfCtThsZHuhzQYwfugDihJQ
41,2023-09-29T15:19:12Z,2023-09-29T15:19:12Z,Wrecking Row,A Zoom call with neck and eye pain. Fantastic,A Zoom call with neck and eye pain. Fantastic,none,0,UCbC74YH_YOsjPerBR2Uo7eA
42,2023-09-29T15:18:29Z,2023-09-29T15:25:42Z,Huia Joy,"Wow this is so cool integrating physical world and the digital world I love this. Well done Mark, thank you for sharing Lex ❤ from Australia 💋 for descendants being able to interact with ancestors is more emotionally impactful. Hmm actually as a better way to online date oops bit of catfishing if there hasn’t been a image update. Exciting all the same. So enhancing to humankind well done","Wow this is so cool integrating physical world and the digital world I love this. Well done Mark, thank you for sharing Lex ❤ from Australia 💋 for descendants being able to interact with ancestors is more emotionally impactful. Hmm actually as a better way to online date oops bit of catfishing if there hasn’t been a image update. Exciting all the same. So enhancing to humankind well done",none,0,UC7qVJRVQnm8b23mdDal8sJQ
43,2023-09-29T15:17:37Z,2023-09-29T15:17:37Z,bestneverlost,"& then suddenly, Lex had a true reason to show emotion","&amp; then suddenly, Lex had a true reason to show emotion",none,0,UC2sWXqI45E_woSCQy1AOGfg
44,2023-09-29T15:17:25Z,2023-09-29T15:17:25Z,kaarthik varma,The future is here! Im so blown away by this,The future is here! Im so blown away by this,none,0,UCsJpQhiAsjJM-Wnu_PyQO3Q
45,2023-09-29T15:17:06Z,2023-09-29T15:17:06Z,Maya,This is gross.,This is gross.,none,0,UCPmBJ3Kevue23M6nQKhic7g
46,2023-09-29T15:16:55Z,2023-09-29T15:16:55Z,George Farmer,Incredible. What a time to be alive.,Incredible. What a time to be alive.,none,1,UC210QPUiYoCjm9IEuu5SHLQ
47,2023-09-29T15:16:35Z,2023-09-29T15:16:35Z,Jack Noke,How great it’ll be when you don’t have to wear a headset of that size.,How great it’ll be when you don’t have to wear a headset of that size.,none,0,UCnLyJ8nszL0ao_j0A27qxHQ
48,2023-09-29T15:16:28Z,2023-09-29T15:16:28Z,Clayton Hardee,"This technology is going to take OnlyFans to the next level. It’s also going to redefine social interaction and have an impact on the Incel community. This technology, combined with A.I. technology, is definitely going to have a social influence, even in unforeseen ways. It’s going to transform the way we interact on social platforms, it’s a game-changer for sure!","This technology is going to take OnlyFans to the next level. It’s also going to redefine social interaction and have an impact on the Incel community. This technology, combined with A.I. technology, is definitely going to have a social influence, even in unforeseen ways. It’s going to transform the way we interact on social platforms, it’s a game-changer for sure!",none,0,UCVqRJxwwOVtX8vIRVCxu3eg
49,2023-09-29T15:15:44Z,2023-09-29T15:15:44Z,Tiago Machado,Seems great! Hope we can all try it soon. Can you share how did you feel in terms of comfort during and after the experiment/interview ?,Seems great! Hope we can all try it soon. Can you share how did you feel in terms of comfort during and after the experiment/interview ?,none,0,UCGHbsqRN-_GDXgGl-7xnm_w
50,2023-09-29T15:15:26Z,2023-09-29T15:15:26Z,WRAITH!,"This is insane!, imagine you skipped the intro. Would you know these sre avatars?","This is insane!, imagine you skipped the intro. Would you know these sre avatars?",none,0,UCBR1rKXm-0L5qQpUYLZiSfg
51,2023-09-29T15:15:12Z,2023-09-29T15:15:12Z,Alekius ,Let's just ACCEPT the fact that we're living in a Star Wars movie.,Let&#39;s just ACCEPT the fact that we&#39;re living in a Star Wars movie.,none,0,UCdEaDmGzs4k9i205pVJkpHA
52,2023-09-29T15:14:20Z,2023-09-29T15:14:20Z,MALACHISTO,"Awesome, I would love to test this too! :)","Awesome, I would love to test this too! :)",none,0,UCdcQOUjrg1ThIiLnnf91wIw
53,2023-09-29T15:14:04Z,2023-09-29T15:14:04Z,Enne,"This is funny. These two people have ne facial expression, so it looks perfectly realistic. Best case senario XD","This is funny. These two people have ne facial expression, so it looks perfectly realistic. Best case senario XD",none,0,UCO5wDsliN9_Tl-8l0EUUY9g
54,2023-09-29T15:12:00Z,2023-09-29T15:12:00Z,K B,Noo Lex. 😞,Noo Lex. 😞,none,0,UCBvTBUvVxLwJ4IldIdpXtJw
55,2023-09-29T15:10:34Z,2023-09-29T15:10:34Z,Martin Garay - Google Analytics & Tag Manager,👏👏👏👏🙌,👏👏👏👏🙌,none,0,UC5QcFNJ_oBYbXXGD-qO6kFQ
56,2023-09-29T15:10:12Z,2023-09-29T15:10:12Z,Emma Burton,how is that different from zoom,how is that different from zoom,none,0,UCBEsmLIR9ZubQBMkVF1vJsA
57,2023-09-29T15:09:21Z,2023-09-29T15:09:21Z,Hugo Stiglitz,For some reason this reminds me of LSD,For some reason this reminds me of LSD,none,0,UCEm8IxB4DfpHPXO5iSsdhRQ
58,2023-09-29T15:08:55Z,2023-09-29T15:09:24Z,Joe Byer,The Metaverse is the Matrix. Incredible!!!,The Metaverse is the Matrix. Incredible!!!,none,0,UCUkKpNSjsSbGY8oqfNRUNNQ
59,2023-09-29T15:08:54Z,2023-09-29T15:22:01Z,Recovery +,"One small step for man, and a giant leap for incels around the world 🎉","One small step for man, and a giant leap for incels around the world 🎉",none,0,UCUl1WdRJEjEnSB2-CdXb6OQ
60,2023-09-29T15:07:38Z,2023-09-29T15:07:38Z,Prometeo59,"Quite few questions are pending. How did they render the avatars?

It looks like something that cannot be done at home and is purely experimental/marketing.

There should be some disclaimers about it.",Quite few questions are pending. How did they render the avatars?<br><br>It looks like something that cannot be done at home and is purely experimental/marketing.<br><br>There should be some disclaimers about it.,none,0,UCHrgcFL-RJ8pQdyEze0tH-w
61,2023-09-29T15:05:32Z,2023-09-29T15:05:32Z,Games without Alex,"You know the funny part about this is, they did this just for you to try to up sell this shit headset, metaverse characters don't even have legs, let alone photo-realizm. Gimmick for hype.","You know the funny part about this is, they did this just for you to try to up sell this shit headset, metaverse characters don&#39;t even have legs, let alone photo-realizm. Gimmick for hype.",none,0,UC42oPrZCBqs_-xrQ8Cv_n_Q
62,2023-09-29T15:05:15Z,2023-09-29T15:05:15Z,Reece Gunningham,"Next, the neck","Next, the neck",none,0,UCmIglVVtuzm1S_sB-kzO7bA
63,2023-09-29T15:04:37Z,2023-09-29T15:04:37Z,Dagr,Online poker is going to get absolutely wild.,Online poker is going to get absolutely wild.,none,0,UCTtKjJUnX45uo9vOmK1g1MA
64,2023-09-29T15:04:08Z,2023-09-29T15:04:08Z,Tablets and Trees,Don't kid yourselves. It looks awful.,Don&#39;t kid yourselves. It looks awful.,none,0,UCxColTDtkQu46QYw1hA9Grg
65,2023-09-29T15:04:06Z,2023-09-29T15:04:06Z,DeadwaterBlacksmithing,So you can shoot people in digital land but not tell someone to go get fooked or else the zuck will ban you... Dude is so full of shit Lex... If you didnt have a man crush on him you might actually challenge him on some important issues like his censorship of reality and truth because it aligns with his own agenda...,So you can shoot people in digital land but not tell someone to go get fooked or else the zuck will ban you... Dude is so full of shit Lex... If you didnt have a man crush on him you might actually challenge him on some important issues like his censorship of reality and truth because it aligns with his own agenda...,none,0,UCkZVfpawi1nQ9mOKbRKbYBg
66,2023-09-29T15:02:23Z,2023-09-29T15:02:23Z,lopazio,I can see people scanning themselves at their 20s and never upgrading it.😄 Forever young in meetings.,I can see people scanning themselves at their 20s and never upgrading it.😄 Forever young in meetings.,none,2,UCiR0L38W0CUaaKxSO35K_pg
67,2023-09-29T15:01:20Z,2023-09-29T15:01:20Z,Scott Gust,"seriously i couldnt care less, RL interactions are what the future needs","seriously i couldnt care less, RL interactions are what the future needs",none,0,UCJI0puGtnFoxY4ts4wmAB3A
68,2023-09-29T14:59:26Z,2023-09-29T14:59:26Z,MeMeeD !,I think this is the meta we expected and deserved.,I think this is the meta we expected and deserved.,none,0,UCIdUwMhQ95b4gymnMEnTtpQ
69,2023-09-29T14:57:41Z,2023-09-29T15:07:55Z,Lance Walker,"I've just had the strangest epiphany! Ovid was not speaking strictly literally when he called the source of Narcissus's reflection a ""pool of water"", and in fact, it now seems plausible to consider the whole story a prophecy rather than a recollection: Narcissus didn't stumble upon a pool of water, *we* stumbled upon this AR technology and an invitation to the Metaverse... and this makes his fate all together more understandable, it even seems reasonable not to consider Narcissus unique or strange in any way relative to humanity in general; how perfectly average and even mundane and certainly easy to understand Narcissus is today, there remains nothing mysterious about his story whatsoever, and clearly people today would not be mistaken to say of each-other what is true of ourselves: ""we dream upon a love that's bodiless, now we believe that what is but a shade must be a body."" What a rarity it must be today to find even one person uncursed by an Echo, so rare it may even be considered miraculous for such a person to exist today, I dare say most people found today are probably cursed by more than merely one but actually several (likely even a countless many) Echoes. Narcissus couldn't escape the doom of even one Echo, and in his case even Apollo tried to shine his light on the path back to freedom, yet even Apollo failed to deliver to him that sight; and what are our odds compared to his, what is our fate most likely to be? Well it seems most likely that the world will soon gain main beautiful flowers and Gaia will hardly regret the loss for that gain... after all, we have many curses and yet there is not even a single god to be found. Perhaps there is hope in the consideration of our modern disposition compared to that of Narcissus, namely that it remains to be wondered how different the fate of Narcissus may have been had he been an atheist like ourselves... though I have a feeling that such a hope is probably really just more shade.","I&#39;ve just had the strangest epiphany! Ovid was not speaking strictly literally when he called the source of Narcissus&#39;s reflection a &quot;pool of water&quot;, and in fact, it now seems plausible to consider the whole story a prophecy rather than a recollection: Narcissus didn&#39;t stumble upon a pool of water, <b>we</b> stumbled upon this AR technology and an invitation to the Metaverse... and this makes his fate all together more understandable, it even seems reasonable not to consider Narcissus unique or strange in any way relative to humanity in general; how perfectly average and even mundane and certainly easy to understand Narcissus is today, there remains nothing mysterious about his story whatsoever, and clearly people today would not be mistaken to say of each-other what is true of ourselves: &quot;we dream upon a love that&#39;s bodiless, now we believe that what is but a shade must be a body.&quot; What a rarity it must be today to find even one person uncursed by an Echo, so rare it may even be considered miraculous for such a person to exist today, I dare say most people found today are probably cursed by more than merely one but actually several (likely even a countless many) Echoes. Narcissus couldn&#39;t escape the doom of even one Echo, and in his case even Apollo tried to shine his light on the path back to freedom, yet even Apollo failed to deliver to him that sight; and what are our odds compared to his, what is our fate most likely to be? Well it seems most likely that the world will soon gain main beautiful flowers and Gaia will hardly regret the loss for that gain... after all, we have many curses and yet there is not even a single god to be found. Perhaps there is hope in the consideration of our modern disposition compared to that of Narcissus, namely that it remains to be wondered how different the fate of Narcissus may have been had he been an atheist like ourselves... though I have a feeling that such a hope is probably really just more shade.",none,0,UChYG4Z2jRYEYJ9GtiVqfrPQ
70,2023-09-29T14:57:40Z,2023-09-29T14:57:40Z,M Wess,Why would you make yourself ugly in the metaverse too??,Why would you make yourself ugly in the metaverse too??,none,0,UCs6gNmHa_Ax4sWNzapYXSmA
