,published_At,updated_At,author_DisplayName,text_Original,text_Display,viewer_Rating,like_Count,author_Channel_Id
82,2023-09-28T22:51:42Z,2023-09-28T22:51:42Z,Ben Sang,"this is the most animated lex has ever been, I can feel his excitement. but hes not real, mind blown. this is like watching the Saturn V or StarShip take off, nothing will be the same after this.","this is the most animated lex has ever been, I can feel his excitement. but hes not real, mind blown. this is like watching the Saturn V or StarShip take off, nothing will be the same after this.",none,0,UC85Yr-g3Q6VhDvDCUMJRWjw
83,2023-09-28T22:51:35Z,2023-09-28T22:51:35Z,Nas,"at  6:17,  they forgot to scan Mark's tongue.","at  <a href=""https://www.youtube.com/watch?v=MVYrJJNdrEg&amp;t=6m17s"">6:17</a>,  they forgot to scan Mark&#39;s tongue.",none,0,UCseEw9e8h-Zb0lrFq4TrTdA
84,2023-09-28T22:51:08Z,2023-09-28T22:51:08Z,Me de,Why is the Zuckerbutt so stuck on phones? You need a phone to activate quest 2. Probably same for quest3. The thing has cameras all over it for crying out loud. It is far better than a phone. Coupling it to a phone was so idiotic.,Why is the Zuckerbutt so stuck on phones? You need a phone to activate quest 2. Probably same for quest3. The thing has cameras all over it for crying out loud. It is far better than a phone. Coupling it to a phone was so idiotic.,none,0,UCsKSn_WtCLtakiuykXw5v8A
85,2023-09-28T22:50:57Z,2023-09-28T22:50:57Z,Clayton Young,Fake Lex has a better shirt.,Fake Lex has a better shirt.,none,0,UCmdBu7oZrTZvZprk6Hj073Q
86,2023-09-28T22:50:51Z,2023-09-28T22:50:51Z,Niger,👃,👃,none,0,UC0DsT3X_gkdc5n-DeeuGLEA
87,2023-09-28T22:50:44Z,2023-09-28T22:50:44Z,RCL,What will the Reptilians think of next … kidding ofc.,What will the Reptilians think of next … kidding ofc.,none,0,UC7YXfCtDRPPkh9ikYHN2vDA
88,2023-09-28T22:50:39Z,2023-09-28T22:50:39Z,António Júlio Sousa,"10:14 ""That's gonna be the meme: the two most monotone people are in the metaverse together"" 😄😄😄","<a href=""https://www.youtube.com/watch?v=MVYrJJNdrEg&amp;t=10m14s"">10:14</a> &quot;That&#39;s gonna be the meme: the two most monotone people are in the metaverse together&quot; 😄😄😄",none,0,UCXedHJFpMdgJRxODFyeV76Q
89,2023-09-28T22:50:21Z,2023-09-28T22:50:45Z,Gabriel Ferrão,"ok... thats unreal, i mean, real as f*","ok... thats unreal, i mean, real as f*",none,0,UCSUmrZW2dg0iaVI3XfNKfnQ
90,2023-09-28T22:49:56Z,2023-09-28T22:49:56Z,Up2Mischief,“We humans…” yeah sure lex…,“We humans…” yeah sure lex…,none,0,UCiQXaBSbpYR3kF2I5Er20Dw
91,2023-09-28T22:49:47Z,2023-09-28T22:49:47Z,Alexander Kuzmuk,"This is awesome! Lex looks much more realistic than Mark. Looking forward to see at least hands added into a model. Also, I think ears and tongue motion need some further fine tuning.","This is awesome! Lex looks much more realistic than Mark. Looking forward to see at least hands added into a model. Also, I think ears and tongue motion need some further fine tuning.",none,0,UC5deYAkf069u8K1BVrJa6qQ
92,2023-09-28T22:49:39Z,2023-09-28T22:49:39Z,Checkboxxx Productions,Mark looks more real in Meta than he does in real life,Mark looks more real in Meta than he does in real life,none,0,UCX6CoDtW-AS3Qit9hO-NVjQ
93,2023-09-28T22:49:30Z,2023-09-28T22:49:30Z,Ben 87,Eerily amazing,Eerily amazing,none,0,UCvaoSakG5YAgDS-AVdQQvXg
94,2023-09-28T22:48:59Z,2023-09-28T22:48:59Z,IIAndreio,This was Jaw dropping,This was Jaw dropping,none,0,UC87NZivVWZtgSRjGSs-a0RA
95,2023-09-28T22:48:55Z,2023-09-28T22:48:55Z,Jo So,Outstanding. I love this. The possibilities are vast,Outstanding. I love this. The possibilities are vast,none,0,UCSFiT_YdPM8LjBgdFqjyO9w
96,2023-09-28T22:48:32Z,2023-09-28T22:48:32Z,Unknown,Mark is gonna win the tech game yet again - As he did in the beginning…,Mark is gonna win the tech game yet again - As he did in the beginning…,none,0,UCYDajdyW7AtGudEBCrHryTQ
97,2023-09-28T22:48:12Z,2023-09-28T22:48:12Z,Marshall Rapp,This podcast should be made available to view in VR.,This podcast should be made available to view in VR.,none,0,UCRJyIgPBiAtXdSPNhYAIEPQ
98,2023-09-28T22:47:51Z,2023-09-28T22:47:51Z,LeatherBootsJohnson,so cool,so cool,none,0,UCTUDG-EELMKbl2ApQx9rH8w
99,2023-09-28T22:47:09Z,2023-09-28T22:47:09Z,Notoginseng37,"All I could think of was how government will use this technology to deceive and manipulate people or how criminals will use this to commit crimes in a whole new level. Or how this will cause further divide between the haves and the have nots. And taking school and workplace bullying to a whole new level. How would you make someone commit suicide using this technology, because they will. These avatars will always play to people's vanities, furthering facial enhancement we already have. We will have people with new addictions and mental health problems, new kinds of agoraphobia, of meeting people IRL, oh the disappointment, is that what you really look like?","All I could think of was how government will use this technology to deceive and manipulate people or how criminals will use this to commit crimes in a whole new level. Or how this will cause further divide between the haves and the have nots. And taking school and workplace bullying to a whole new level. How would you make someone commit suicide using this technology, because they will. These avatars will always play to people&#39;s vanities, furthering facial enhancement we already have. We will have people with new addictions and mental health problems, new kinds of agoraphobia, of meeting people IRL, oh the disappointment, is that what you really look like?",none,0,UCLpb5scMvSrECwKnLnh1HZw
