,published_At,updated_At,author_DisplayName,text_Original,text_Display,viewer_Rating,like_Count,author_Channel_Id
73,2023-09-28T20:57:05Z,2023-09-28T20:58:12Z,mikey180211,"It's technology like this that has enabled the miserable, progress-dependent global society that we all find ourselves in. How ironic that now they're marketing this as though it's the remedy to our isolated lives when in reality it's a doubling-down of the progress/productivity doctrine that forced us apart. There's only one thing so-called progress is good for and that's wealth. They'll generate imaginary use cases for this bullshit technology and gradually we'll all adopt it, rendering it a necessity and giving them a brand new inexhaustible revenue stream. All the while the cost of such technology, both material and spiritual, is downplayed or outright ignored. How much longer are we going to allow this kind of social engineering?","It&#39;s technology like this that has enabled the miserable, progress-dependent global society that we all find ourselves in. How ironic that now they&#39;re marketing this as though it&#39;s the remedy to our isolated lives when in reality it&#39;s a doubling-down of the progress/productivity doctrine that forced us apart. There&#39;s only one thing so-called progress is good for and that&#39;s wealth. They&#39;ll generate imaginary use cases for this bullshit technology and gradually we&#39;ll all adopt it, rendering it a necessity and giving them a brand new inexhaustible revenue stream. All the while the cost of such technology, both material and spiritual, is downplayed or outright ignored. How much longer are we going to allow this kind of social engineering?",none,3,UC8511qvNPEsYFu-QJ22yJCA
74,2023-09-28T20:56:50Z,2023-09-28T20:56:50Z,Kristofer Mondlane,So… @lexfriedman is now an ad platform for big tech?.. or was he always. Not entirely fair to Lex as I appreciate this behind the scenes view of the metaverse. It does look magical.,So… @lexfriedman is now an ad platform for big tech?.. or was he always. Not entirely fair to Lex as I appreciate this behind the scenes view of the metaverse. It does look magical.,none,0,UCV2659-WOTG7JNLdSqFPIdA
75,2023-09-28T20:56:49Z,2023-09-28T20:56:49Z,Aussie,Lex lost for words. Perhaps there's words in Russian ?,Lex lost for words. Perhaps there&#39;s words in Russian ?,none,0,UCy3eztnwJonnZ-R7RLsDh8A
76,2023-09-28T20:56:37Z,2023-09-28T20:56:37Z,Jordan Garland,"Unbelievable how fast this has progressed, and the tactics used to get there. 
Some early thoughts- If the goal is to translate to a viewer as more than 2D, switch camera angles often. I get it is imitating the podcast, but what if I want to watch my avatar interact, or just see someone from different angles?","Unbelievable how fast this has progressed, and the tactics used to get there. <br>Some early thoughts- If the goal is to translate to a viewer as more than 2D, switch camera angles often. I get it is imitating the podcast, but what if I want to watch my avatar interact, or just see someone from different angles?",none,0,UCQZXTAANpVtpEC7Cyqbgd0w
77,2023-09-28T20:56:34Z,2023-09-28T20:56:34Z,pumpuppthevolume,Lex would have had a blast if he had a virtual hand mirror lol,Lex would have had a blast if he had a virtual hand mirror lol,none,0,UCS4mWBkFq2dsxfUbYn7h3lw
78,2023-09-28T20:56:22Z,2023-09-28T20:56:22Z,Rakesh Lahoti,Two robots talking in a Metaverse… what a time to be alive!,Two robots talking in a Metaverse… what a time to be alive!,none,0,UC9uYc5-gEJ8BPGKc4kbEqRg
79,2023-09-28T20:56:17Z,2023-09-28T20:56:17Z,Military Videos with Corporal Stock,"Okay, it's pretty impressive.  But I'm waiting for the Apple product.  I also assume everyone's experience won't quite be the same, I would think they did a lot of work scanning in their bodies, etc.","Okay, it&#39;s pretty impressive.  But I&#39;m waiting for the Apple product.  I also assume everyone&#39;s experience won&#39;t quite be the same, I would think they did a lot of work scanning in their bodies, etc.",none,0,UCdM5JoNiaKh6DR-WgPHz0ow
80,2023-09-28T20:56:06Z,2023-09-28T20:56:06Z,Matt Pocius on Tesla Stock & Money,Fascinating tech,Fascinating tech,none,0,UCF1iS7Bp9_hsQphNF6o8qwQ
81,2023-09-28T20:56:03Z,2023-09-28T20:56:03Z,QBERT ATX,THE FUTURE OF PORN !❤,THE FUTURE OF PORN !❤,none,0,UCPfTk4vDOlLlscxzKIRyTxg
82,2023-09-28T20:55:56Z,2023-09-28T20:55:56Z,Matt Pocius on Tesla Stock & Money,We'll need to start calling them flying heads. No more talking heads :),We&#39;ll need to start calling them flying heads. No more talking heads :),none,0,UCF1iS7Bp9_hsQphNF6o8qwQ
83,2023-09-28T20:55:53Z,2023-09-28T20:55:53Z,itsya boi,witnessing history,witnessing history,none,0,UC6zkOc7SkCbg5sABKiEISRQ
84,2023-09-28T20:55:53Z,2023-09-28T20:55:53Z,Young Cho,Beginning of the matrix,Beginning of the matrix,none,0,UCxmGptoB_GcreL1a8Ilf2Hg
85,2023-09-28T20:55:44Z,2023-09-28T20:55:44Z,Jared Eagles,"No offence, mark, but this is extremely corny.  im sure if you spent less time online and focused on your online presence, the ideas you'd come up with would make more sense in the real world, and be more of a benefit to others in real life scenarios.","No offence, mark, but this is extremely corny.  im sure if you spent less time online and focused on your online presence, the ideas you&#39;d come up with would make more sense in the real world, and be more of a benefit to others in real life scenarios.",none,1,UCsDS5Rq5rj0LcepKlfWnolA
86,2023-09-28T20:55:31Z,2023-09-28T20:55:31Z,cypher,I want my avatar to be this real but i want to look like a wizard. please add face filters please 🙏,I want my avatar to be this real but i want to look like a wizard. please add face filters please 🙏,none,1,UCVwgdF5YAlrYNAzWGSxqxMg
87,2023-09-28T20:55:26Z,2023-09-28T20:55:26Z,Jesus,I wouldn't fuck with Meta Fridman,I wouldn&#39;t fuck with Meta Fridman,none,0,UCSwjpVphp0cJQLIK-0yE3sg
88,2023-09-28T20:55:26Z,2023-09-28T20:55:26Z,Pataki Satori,Lex sounds like he’s tripping,Lex sounds like he’s tripping,none,1,UCqMXYP5XZFaRhFfwexz3WRQ
89,2023-09-28T20:55:25Z,2023-09-28T20:55:25Z,superlouis914,What a joke this really is. It will never see the light of the day. Apple is probably the closest to this AR era if it even comes close.,What a joke this really is. It will never see the light of the day. Apple is probably the closest to this AR era if it even comes close.,none,0,UC0pmuQpubXVZUzsETrdbCag
90,2023-09-28T20:55:19Z,2023-09-28T20:55:19Z,D L,Is anything real in the future?,Is anything real in the future?,none,0,UCSP_Bz5z-J3gz3-zhBIvOWQ
91,2023-09-28T20:55:14Z,2023-09-28T20:55:14Z,pumpuppthevolume,he should have done demos like this a long time ago,he should have done demos like this a long time ago,none,1,UCS4mWBkFq2dsxfUbYn7h3lw
92,2023-09-28T20:55:13Z,2023-09-28T20:55:13Z,Robb Keele,"Sometimes technology solves problems we don't have.  Social media, for example. How could this go wrong?","Sometimes technology solves problems we don&#39;t have.  Social media, for example. How could this go wrong?",none,0,UCutLxavIhGFKwkNcunCYGbQ
93,2023-09-28T20:55:13Z,2023-09-28T20:55:13Z,pantherstealth1,Would use the shjt out of that augm capability.  I would never leave except to manually walk and enjoy nature in reality.,Would use the shjt out of that augm capability.  I would never leave except to manually walk and enjoy nature in reality.,none,0,UCp7Q_CKLvJXH3BGa1kBe9Xw
94,2023-09-28T20:55:10Z,2023-09-28T20:55:10Z,David Betancourt,"Okay, this is tripping me out. I was wondering why Lex was standing up in a room initially.... then, shit, it's just his g/d digital avatar. lol wut?","Okay, this is tripping me out. I was wondering why Lex was standing up in a room initially.... then, shit, it&#39;s just his g/d digital avatar. lol wut?",none,1,UCRWN9Itas0dA15NWy-hV3mg
95,2023-09-28T20:55:06Z,2023-09-28T20:55:06Z,Big ram Toner,Does Klaus pop up at any point??,Does Klaus pop up at any point??,none,0,UCXGvKDu5PTaQfJUQ4Op7TkQ
96,2023-09-28T20:55:00Z,2023-09-28T20:55:09Z,Matt Pocius on Tesla Stock & Money,Not realistic at all - Lex has no suit! lol,Not realistic at all - Lex has no suit! lol,none,1,UCF1iS7Bp9_hsQphNF6o8qwQ
97,2023-09-28T20:55:00Z,2023-09-28T20:55:00Z,Vova Z,"The eyes are still dead though. Why are these so hard to get right? I mean, Stable Diffusion does this flawlessly?","The eyes are still dead though. Why are these so hard to get right? I mean, Stable Diffusion does this flawlessly?",none,0,UCLxwsPvBzob7ws0dRd1ov4A
98,2023-09-28T20:54:45Z,2023-09-28T20:54:45Z,Jesús Escalona,Seems like they’re about to kiss,Seems like they’re about to kiss,none,0,UCkY191-cX_8OkE3kr9xOoVg
99,2023-09-28T20:54:40Z,2023-09-28T20:54:57Z,gmmg,Is Mark finally showing us the Zuck?,Is Mark finally showing us the Zuck?,none,1,UCTQTXGjgasF5a0irJXsUYSA
