,published_At,updated_At,author_DisplayName,text_Original,text_Display,viewer_Rating,like_Count,author_Channel_Id
90,2023-09-28T20:10:47Z,2023-09-28T20:10:47Z,EyeQ,"On Marcs comments. I think we have to reach photorelasitic first before we can or would/should  ""shape"" ourselfs in what we like to be. For what reason it is. To fit in the scene or what i found more difficult, we don´t like ourselfs. To change that in a click of a button is more of the grey areas of that tec.","On Marcs comments. I think we have to reach photorelasitic first before we can or would/should  &quot;shape&quot; ourselfs in what we like to be. For what reason it is. To fit in the scene or what i found more difficult, we don´t like ourselfs. To change that in a click of a button is more of the grey areas of that tec.",none,0,UCMAcRinHCjmvANXlTgY3rhQ
91,2023-09-28T20:10:46Z,2023-09-28T20:10:46Z,alwaysyouramanda,"Holy cow this is exciting, especially with what AI seems to be capable of-!! Imagine changing up your Codec avi with just a verbal promt","Holy cow this is exciting, especially with what AI seems to be capable of-!! Imagine changing up your Codec avi with just a verbal promt",none,1,UCf63RkepvfMTV3nk4v-xZ5w
92,2023-09-28T20:10:46Z,2023-09-28T20:10:46Z,Amín Romero,You need to do an AI translation/dubbed to this episode and it would feel even more futuristic for everyone outside the US!,You need to do an AI translation/dubbed to this episode and it would feel even more futuristic for everyone outside the US!,none,2,UCY_skA651TkHbgsnh9tbWJw
93,2023-09-28T20:10:38Z,2023-09-28T20:10:38Z,kazuki nakamura,You know this guy is bloodguilty right? You aren’t smart enough to realize that?,You know this guy is bloodguilty right? You aren’t smart enough to realize that?,none,0,UC-T5AaqtigN77jbtVlYqrcw
94,2023-09-28T20:10:28Z,2023-09-28T20:10:28Z,John Tulp,"This is incredible.  I hope devices like this can be used in the future to help people.  Trauma victims, for example might greatly benefit from something like this!!!","This is incredible.  I hope devices like this can be used in the future to help people.  Trauma victims, for example might greatly benefit from something like this!!!",none,1,UCQr3eDRvQK9HkuKb4md67nA
95,2023-09-28T20:09:50Z,2023-09-28T20:09:50Z,Paul Johnson,Ok now it’s starting to look like a metaverse…. These avatars in a high detailed interactive environment and then boom world changing.,Ok now it’s starting to look like a metaverse…. These avatars in a high detailed interactive environment and then boom world changing.,none,2,UC3SJMgEYFN7KbCwpCB0GLWg
96,2023-09-28T20:09:47Z,2023-09-28T20:09:47Z,And-Or101,"Ironically, the Matrix is becoming a ”reality.”","Ironically, the Matrix is becoming a ”reality.”",none,1,UCqUEl6pjEHuGocTH2iWba-w
97,2023-09-28T20:09:45Z,2023-09-28T20:09:45Z,fenrisler,this is insane..,this is insane..,none,0,UCuLa-QyO0qpyGtQAoacw28w
98,2023-09-28T20:09:38Z,2023-09-28T20:09:38Z,Lucas Salomon,"Zuckerberg almost looks realistic




The CG version is getting there too.",Zuckerberg almost looks realistic<br><br><br><br><br>The CG version is getting there too.,none,0,UCar3iJNTGKczhULYbpGdzYA
