,published_At,updated_At,author_DisplayName,text_Original,text_Display,viewer_Rating,like_Count,author_Channel_Id
77,2023-09-28T21:38:15Z,2023-09-28T21:38:15Z,Arrakis,"Is someone deleting comments here? Or am I the only one thinking critically about this? People don't realize that zuckerberg is planting seeds of ideas into your heads that are very likely to do nothing with what's good for you or us, but much more with making multi-billion dollar investment for one of the biggest publicly traded companies worth it. Please put down your rose-colored glasses. There is so much that's underneath what's discussed here. It's not about the technology, it's not about making our lives better. Did Facebook in the past bring joy into our lives or did they create this giant mess that we're still recovering from?","Is someone deleting comments here? Or am I the only one thinking critically about this? People don&#39;t realize that zuckerberg is planting seeds of ideas into your heads that are very likely to do nothing with what&#39;s good for you or us, but much more with making multi-billion dollar investment for one of the biggest publicly traded companies worth it. Please put down your rose-colored glasses. There is so much that&#39;s underneath what&#39;s discussed here. It&#39;s not about the technology, it&#39;s not about making our lives better. Did Facebook in the past bring joy into our lives or did they create this giant mess that we&#39;re still recovering from?",none,0,UCj18r5PE_Zi_NUpAlXH1Xdw
78,2023-09-28T21:37:55Z,2023-09-28T21:37:55Z,Nathaniel Gibson,Did lex have that little bruise on his right forehead when he went to get the scan?,Did lex have that little bruise on his right forehead when he went to get the scan?,none,0,UCouGwkeDCvuvPGXYA3VwJwQ
79,2023-09-28T21:37:33Z,2023-09-28T21:37:33Z,Laãyøn,This is gayer than aids,This is gayer than aids,none,0,UCXSkdd_7UuD0Qh77fxKhP9A
80,2023-09-28T21:37:27Z,2023-09-28T21:37:27Z,Skarredghost,"It looks cringe. I mean, more than usual","It looks cringe. I mean, more than usual",none,0,UC5TQ0u_d4KbIvaBW9LuVUsg
81,2023-09-28T21:37:24Z,2023-09-28T21:37:24Z,Meditation Healing Frequencies,Crazy that even Lex's feeling of awe and child-like joy comes across through his avatar!,Crazy that even Lex&#39;s feeling of awe and child-like joy comes across through his avatar!,none,75,UCS_ZM_jQDmpu_Y0Gh8UgZnQ
82,2023-09-28T21:37:21Z,2023-09-28T21:37:21Z,BubbleBobble,This guys single handedly killed one of the coolest innovations in a while 💀,This guys single handedly killed one of the coolest innovations in a while 💀,none,0,UC_G94prMdBnamjRnpYG2V0A
83,2023-09-28T21:37:17Z,2023-09-28T21:37:17Z,Eduard ZH.,I've been using VR headsets for like 8 years now. But now I'm really blown away. These avatars... That's a game changer!,I&#39;ve been using VR headsets for like 8 years now. But now I&#39;m really blown away. These avatars... That&#39;s a game changer!,none,1,UCZoBKGUGYGUPAJoZCQ4RG5w
84,2023-09-28T21:37:10Z,2023-09-28T21:37:10Z,Dany Nata,"real life lex expression:          :|
metaverse lex expression:    :)",real life lex expression:          :|<br>metaverse lex expression:    :),none,0,UC6kh3vjKVEk3Whub5WYsc0Q
85,2023-09-28T21:37:01Z,2023-09-28T21:37:01Z,Chad Waronicki,Having different load outs facial hair/hairstyle options. Be clean shaven and neat for a professional application and throw on the beard and long hair for a concert. Cool times ahead,Having different load outs facial hair/hairstyle options. Be clean shaven and neat for a professional application and throw on the beard and long hair for a concert. Cool times ahead,none,0,UCwOZSy0HAn4Oeds06I5qAVg
86,2023-09-28T21:36:56Z,2023-09-28T21:36:56Z,Nettskape,This is crazy!!!! I thought they were just being silly for the first 10 mins 😮,This is crazy!!!! I thought they were just being silly for the first 10 mins 😮,none,0,UCHmoO2jjlXUXwIP8qN7MNXw
87,2023-09-28T21:36:43Z,2023-09-28T21:36:43Z,Tiffany L,we live in a simulation,we live in a simulation,none,0,UCLEeFbuLjmys_k7hLGNkkdQ
88,2023-09-28T21:36:31Z,2023-09-28T21:36:31Z,BagOfEyebrows,9:11 to 9:14 the avatar was definitely more emotive than Lex was outwardly - :) :D,"<a href=""https://www.youtube.com/watch?v=MVYrJJNdrEg&amp;t=9m11s"">9:11</a> to <a href=""https://www.youtube.com/watch?v=MVYrJJNdrEg&amp;t=9m14s"">9:14</a> the avatar was definitely more emotive than Lex was outwardly - :) :D",none,0,UCAqwCh46-goaHJwKhgUQTbw
89,2023-09-28T21:36:30Z,2023-09-28T21:36:30Z,Twoandahalfmen,"Being able to talk to someone like this that has passed away is some Black Mirror shit guys, I LOVE IT!","Being able to talk to someone like this that has passed away is some Black Mirror shit guys, I LOVE IT!",none,12,UCzL36RGmz8kOL4pXm9si22A
90,2023-09-28T21:36:25Z,2023-09-28T21:36:25Z,LeBrian,Love the sexual tension.,Love the sexual tension.,none,1,UC1razu87E0F_nt8PYfM6nbg
91,2023-09-28T21:36:22Z,2023-09-28T21:36:22Z,Chauncey Frend,33:18 Lex brings up talking with a digitized AI of a loved one who has passed.  This touches on a need that humanity desperately needs.  All of the good fruits of our nature generally get lost in our cemeteries.,"<a href=""https://www.youtube.com/watch?v=MVYrJJNdrEg&amp;t=33m18s"">33:18</a> Lex brings up talking with a digitized AI of a loved one who has passed.  This touches on a need that humanity desperately needs.  All of the good fruits of our nature generally get lost in our cemeteries.",none,0,UCeRz6bfhqb9xtvp1KVrTDkw
92,2023-09-28T21:35:50Z,2023-09-28T21:35:50Z,Hawtboxxin,Cam girls are gonna get super expensive,Cam girls are gonna get super expensive,none,0,UC_QAXGIbBnc3mJFqYQ1f8tg
93,2023-09-28T21:35:44Z,2023-09-28T21:35:44Z,Cagdas ilter,This is crazy good!,This is crazy good!,none,0,UCGg1tHOpooSAxEvRYOlsjNg
94,2023-09-28T21:35:38Z,2023-09-28T21:35:38Z,Klassisk Musikk,The future is beautiful omg,The future is beautiful omg,none,0,UCLq9c4VwgU09zN7GghkBJtA
95,2023-09-28T21:35:34Z,2023-09-28T21:35:34Z,chinchilla516,Fantastic interview. Well done Lex,Fantastic interview. Well done Lex,none,2,UC3i0E8xQv0z5cWoVLWX30Xw
96,2023-09-28T21:35:21Z,2023-09-28T21:35:21Z,jeff meares,Nice,Nice,none,0,UCovfuO8MCDMAM6vn0zoZtLw
97,2023-09-28T21:35:07Z,2023-09-28T21:35:07Z,Parth Gurjar,"What about apple vision pro, can we talk about that?","What about apple vision pro, can we talk about that?",none,0,UCWVKqIpDmiGSesUEbVt0Myg
98,2023-09-28T21:34:27Z,2023-09-28T21:34:27Z,fbl37,in the very start I thought its a start of matrix,in the very start I thought its a start of matrix,none,0,UCzfW36Lbk6in6X7WjwS9FOw
